{
  "tenantId": "vaults",
  "name": "Vaults",
  "colors": {
    "background": "#000000",
    "foreground": "#f1f1ef",
    "card": "#202238",
    "card-foreground": "#f1f1ef",
    "popover": "#202238",
    "popover-foreground": "#f1f1ef",
    "primary": "#2f5ef4",
    "primary-foreground": "#ffffff",
    "primary-hover": "#214fe1",
    "primary-active": "#1b47d2",
    "primary-subtle": "#4278ff",
    "secondary": "#d1a93c",
    "secondary-foreground": "#171829",
    "muted": "#272940",
    "muted-foreground": "#757e9d",
    "accent": "#292c46",
    "accent-foreground": "#f1f1ef",
    "destructive": "#d95656",
    "destructive-foreground": "#ffffff",
    "warning": "#d98556",
    "warning-foreground": "#171829",
    "success": "#48aa69",
    "success-foreground": "#ffffff",
    "border": "#2f314c",
    "input": "#2f3552",
    "input-background": "#272942",
    "input-disabled-background": "#252741",
    "input-disabled-foreground": "#2d2f4c",
    "input-focus-ring": "#4f46e5",
    "input-error-border": "#f43f5e",
    "input-secondary-text": "#475569",
    "input-counter": "#94a3b8",
    "input-error-ring": "#ef4444",
    "checkbox-background": "#ffffff",
    "checkbox-border": "#cbd5e1",
    "checkbox-hover-background": "#eef2ff",
    "checkbox-disabled-background": "#f8fafc",
    "checkbox-disabled-foreground": "#cbd5e1",
    "checkbox-checked": "#4f46e5",
    "checkbox-checked-foreground": "#ffffff",
    "checkbox-focus-ring": "#4f46e5",
    "radio-border": "#757e9d",
    "radio-checked": "#2f5ef4",
    "radio-hover-border": "#4f46e5",
    "radio-disabled-background": "#f8fafc",
    "radio-disabled-dot": "#757e9d",
    "radio-focus-ring": "#4f46e5",
    "switch-unchecked": "#3d4362",
    "switch-unchecked-hover": "#cbd5e1",
    "switch-checked": "#2f5ef4",
    "switch-checked-disabled": "#e0e7ff",
    "switch-thumb": "#ffffff",
    "switch-thumb-disabled": "#f8fafc",
    "switch-thumb-checked-disabled": "#eef2ff",
    "switch-thumb-icon": "#3d4362",
    "switch-track-icon": "#ffffff",
    "switch-focus-ring": "#4f46e5",
    "ring": "#2f5ef4",
    "chart-1": "#396ed4",
    "chart-2": "#e29539",
    "chart-3": "#c2a633",
    "chart-4": "#f5d35a",
    "chart-5": "#8247e5",
    "chart-6": "#b646ef",
    "chart-7": "#464860",
    "chart-tooltip": "#2d2f4c",
    "chart-legend-muted": "#8d96b8",
    "sidebar": "#171829",
    "sidebar-foreground": "#f1f1ef",
    "sidebar-muted-foreground": "#8d96b8",
    "sidebar-primary": "#4278ff",
    "sidebar-primary-foreground": "#ffffff",
    "sidebar-accent": "#2a2c44",
    "sidebar-accent-foreground": "#f1f1ef",
    "sidebar-border": "transparent",
    "sidebar-ring": "#2f5ef4",
    "topnav-logo-title": "#5b6eae",
    "sidenav": "#202238",
    "sidenav-foreground": "#d2d2d2",
    "sidenav-icon": "#8d96b8",
    "sidenav-active": "#4a78ff",
    "sidenav-accent": "#282a44",
    "sidenav-border": "#262b47",
    "status-isolated": "#2bb673",
    "file-upload-background": "#313347",
    "file-upload-border": "#2f3552",
    "file-upload-icon": "#8d96b8",
    "file-upload-disabled-background": "#282a44",
    "file-upload-disabled-foreground": "#454972",
    "date-picker-background": "#171821",
    "date-picker-selected": "#4f46e5",
    "date-picker-range": "#202238",
    "date-picker-trigger": "#272940",
    "date-picker-nav": "#8d96b8",
    "notification-secondary-title": "#1e293b",
    "notification-secondary-supporting": "#475569",
    "notification-secondary-dismiss": "#606f91",
    "notification-primary-supporting-soft": "#f1f5f9",
    "notification-gray-secondary-bg": "#f8fafc",
    "notification-gray-secondary-border": "#e2e8f0",
    "notification-gray-accent": "#4a4f6a",
    "notification-gray-primary-bg": "#606f91",
    "notification-gray-primary-border": "#475569",
    "notification-gray-primary-action-fg": "#3f3557",
    "notification-brand-secondary-bg": "#eef2ff",
    "notification-brand-secondary-border": "#c7d2fe",
    "notification-brand-accent": "#1e2235",
    "notification-brand-primary-bg": "#214fe1",
    "notification-brand-primary-border": "#c7d2fe",
    "notification-destructive-secondary-bg": "#fff1f2",
    "notification-destructive-secondary-border": "#fecdd3",
    "notification-destructive-accent": "#d95656",
    "notification-destructive-primary-bg": "#f87171",
    "notification-destructive-primary-border": "#fda4af",
    "notification-warning-secondary-bg": "#fffbeb",
    "notification-warning-accent": "#d1a93c",
    "notification-warning-primary-bg": "#d49d4b",
    "notification-warning-primary-border": "#fcd34d",
    "notification-warning-primary-fg": "#171829",
    "notification-warning-primary-action": "#1f2139",
    "notification-success-secondary-bg": "#f0fdf4",
    "notification-success-border": "#bbf7d0",
    "notification-success-accent": "#48aa69",
    "breadcrumb-link": "#475569",
    "breadcrumb-current": "#ffffff",
    "breadcrumb-hover": "#818cf8",
    "breadcrumb-separator": "#8d96b8",
    "breadcrumb-subtle-bg": "#f8fafc",
    "breadcrumb-subtle-hover-bg": "#eef2ff",
    "breadcrumb-subtle-active-bg": "#e0e7ff",
    "breadcrumb-current-subtle": "#4f46e5",
    "breadcrumb-disabled": "#cbd5e1",
    "pagination-range": "#757e9d",
    "pagination-page": "#8d96b8",
    "pagination-active-bg": "#272942",
    "pagination-active-fg": "#ffffff",
    "step-incomplete": "#e2e8f0",
    "step-incomplete-foreground": "#cbd5e1",
    "step-disabled-background": "#292b3f",
    "step-disabled-border": "#1f2139",
    "step-disabled-foreground": "#606f91",
    "step-title": "#1e293b",
    "step-supporting": "#475569",
    "step-active-background": "#ffffff",
    "badge-brand-primary-bg": "#2f5ef4",
    "badge-brand-primary-fg": "#ffffff",
    "badge-brand-disabled-bg": "#c7d2fe",
    "badge-brand-disabled-fg": "#818cf8",
    "badge-brand-secondary-bg": "#eef2ff",
    "badge-brand-secondary-hover-bg": "#e0e7ff",
    "badge-brand-secondary-fg": "#2f5ef4",
    "badge-brand-secondary-disabled-fg": "#a5b4fc",
    "badge-brand-outlined-border": "#2f5ef4",
    "badge-brand-outlined-hover-bg": "#eef2ff",
    "badge-brand-outlined-disabled": "#a5b4fc",
    "badge-gray-primary-bg": "#262842",
    "badge-gray-primary-hover-bg": "#475569",
    "badge-gray-primary-fg": "#ffffff",
    "badge-gray-primary-disabled-bg": "#282a44",
    "badge-gray-primary-disabled-fg": "#454972",
    "badge-gray-secondary-bg": "#f8fafc",
    "badge-gray-secondary-hover-bg": "#f1f5f9",
    "badge-gray-secondary-fg": "#475569",
    "badge-gray-secondary-disabled-fg": "#cbd5e1",
    "badge-gray-outlined-border": "#2f314c",
    "badge-gray-outlined-fg": "#2f314c",
    "badge-gray-outlined-hover-bg": "#f8fafc",
    "badge-gray-outlined-hover-border": "#94a3b8",
    "badge-gray-outlined-hover-fg": "#475569",
    "badge-gray-outlined-disabled": "#cbd5e1",
    "badge-coming-soon-bg": "#1b1d32",
    "badge-coming-soon-fg": "#ffffff",
    "badge-premium-fg": "#494137",
    "badge-premium-bg": "linear-gradient(\n    101.29deg,\n    #b49f55 7.39%,\n    #c0b795 47.15%,\n    #b49f55 108.66%\n  )",
    "divider": "#262b47",
    "scrollbar-track": "#313347",
    "scrollbar-thumb": "#8d96b8",
    "dropdown-panel": "#313347",
    "dropdown-search": "#2f314c",
    "dropdown-supporting": "#8a93b5",
    "dropdown-chip-border": "#8d96b8",
    "dropdown-count-bg": "#eef2ff",
    "dropdown-count-fg": "#4f46e5",
    "dropdown-dot-success": "#22c55e",
    "dropdown-dot-warning": "#f59e0b",
    "dropdown-dot-brand": "#4f46e5",
    "dropdown-dot-muted": "#cbd5e1",
    "dropdown-dot-destructive": "#f43f5e",
    "banner-surface": "#202238",
    "banner-foreground": "#f1f1ef",
    "banner-muted": "#757e9d",
    "banner-divider": "#757e9d",
    "banner-gradient": "linear-gradient(\n    257.6deg,\n    color-mix(in srgb, #ab614b 20%, transparent) 0.3%,\n    color-mix(in srgb, #2f5ef4 30%, transparent) 99.6%\n  )",
    "banner-gradient-welcome": "linear-gradient(\n    266.78deg,\n    color-mix(in srgb, #ab614b 20%, transparent) 0.44%,\n    color-mix(in srgb, #5b5084 25%, transparent) 50.78%,\n    color-mix(in srgb, #2f5ef4 30%, transparent) 101.11%\n  )",
    "tab-muted": "#8d96b8",
    "tab-active-fg": "#ffffff",
    "tab-indicator": "#4278ff",
    "tab-rail-bg": "#1b1d32",
    "tab-pill-fg": "#475569",
    "tab-pill-hover-bg": "#f8fafc",
    "tab-pill-active-fg": "#1e293b",
    "tab-pill-active-bg": "#ffffff",
    "tab-pill-active-border": "#4f46e5",
    "tab-pill-disabled": "#cbd5e1",
    "chip-border": "#2f3552",
    "chip-active-bg": "#2f314c",
    "chip-active-border": "#2f5ef4",
    "chip-active-fg": "#c6d6ff",
    "chip-disabled-fg": "#2f3552",
    "chip-status-bg": "#282c46",
    "chip-status-severe": "#d95656",
    "chip-status-high": "#ca7241",
    "chip-status-medium": "#d49d4b",
    "chip-status-low": "#b2b9d1",
    "chip-avatar-bg": "#2f314c",
    "chip-avatar-ring": "#1b1d32",
    "chip-avatar-placeholder": "#989db8",
    "chip-brand-bg": "#2f5ef4",
    "chip-brand-fg": "#ffffff",
    "loader-surface": "#202238",
    "loader-foreground": "#ffffff",
    "skeleton": "#e2e7ef",
    "skeleton-pulse": "#f1f5f9",
    "radius": "0.625rem",
    "radius-sm": "calc(0.625rem - 4px)",
    "radius-md": "calc(0.625rem - 2px)",
    "radius-lg": "0.625rem",
    "radius-xl": "calc(0.625rem + 4px)"
  },
  "branding": {
    "logo": "/assets/logo.svg",
    "favicon": "/assets/favicon.ico"
  }
}
